{
  "title": "Ocean Jukebox Catalog",
  "source": "https://sanctsound.ioos.us/sounds.html",
  "baseUrl": "https://sanctsound.ioos.us/files/",
  "generatedAt": "2026-05-16T02:29:10.862Z",
  "archiveNote": "NOAA SanctSound is a historical passive acoustic archive. These clips are recordings from the 2018-2021/2022 project period, not realtime audio.",
  "tracks": [
    {
      "filename": "SanctSound_FK02_01_atlanticmidshipmanandsnappingshrimp_20190313T073628Z.mp4",
      "url": "https://sanctsound.ioos.us/files/SanctSound_FK02_01_atlanticmidshipmanandsnappingshrimp_20190313T073628Z.mp4",
      "sanctuary": "Florida Keys",
      "category": "fish",
      "label": "Midshipman courtship hum",
      "description": "Continuous humming from male Atlantic midshipman through the spring night — a bass drone from inside rock burrows to attract females.",
      "recordedAt": "2019-03-13T07:36:28Z",
      "site": "FK02",
      "deployment": "01",
      "groupKey": "FK02-01-atlanticmidshipmanandsnappingshrimp-20190313T073628Z",
      "variant": "original",
      "sourceType": "video",
      "sourcePage": "https://sanctsound.ioos.us/sounds.html",
      "catalogedAt": "2026-05-16T02:29:10.862Z"
    },
    {
      "filename": "SanctSound_FK01_01_blackgrouper_20190105T163326Z.mp4",
      "url": "https://sanctsound.ioos.us/files/SanctSound_FK01_01_blackgrouper_20190105T163326Z.mp4",
      "sanctuary": "Florida Keys",
      "category": "fish",
      "label": "Black grouper",
      "description": "Male black grouper emit low frequency rumbling sounds during courtship displays directed towards prospective females while in seasonal spawning aggregations in Florida Keys sanctuary. The monitoring of these sounds can help researchers understand where and when the species is reproducing.",
      "recordedAt": "2019-01-05T16:33:26Z",
      "site": "FK01",
      "deployment": "01",
      "groupKey": "FK01-01-blackgrouper-20190105T163326Z",
      "variant": "original",
      "sourceType": "video",
      "sourcePage": "https://sanctsound.ioos.us/sounds.html",
      "catalogedAt": "2026-05-16T02:29:10.862Z"
    },
    {
      "filename": "SanctSound_CI01_01_bocaccio_20181101T100353Z.mp4",
      "url": "https://sanctsound.ioos.us/files/SanctSound_CI01_01_bocaccio_20181101T100353Z.mp4",
      "sanctuary": "Channel Islands",
      "category": "fish",
      "label": "Bocaccio",
      "description": "Bocaccio produce low frequency sounds such as this call recorded on the north side of Santa Rosa Island in Channel Islands sanctuary in 2018.",
      "recordedAt": "2018-11-01T10:03:53Z",
      "site": "CI01",
      "deployment": "01",
      "groupKey": "CI01-01-bocaccio-20181101T100353Z",
      "variant": "original",
      "sourceType": "video",
      "sourcePage": "https://sanctsound.ioos.us/sounds.html",
      "catalogedAt": "2026-05-16T02:29:10.862Z"
    },
    {
      "filename": "SanctSound_MB01_05_bocaccio_20200508T042435Z.mp4",
      "url": "https://sanctsound.ioos.us/files/SanctSound_MB01_05_bocaccio_20200508T042435Z.mp4",
      "sanctuary": "Monterey Bay",
      "category": "fish",
      "label": "Bocaccio",
      "description": "Bocaccio produce low frequency sounds such as these two consecutive calls recorded in 2020 on the edge of Monterey Canyon in Monterey Bay sanctuary.",
      "recordedAt": "2020-05-08T04:24:35Z",
      "site": "MB01",
      "deployment": "05",
      "groupKey": "MB01-05-bocaccio-20200508T042435Z",
      "variant": "original",
      "sourceType": "video",
      "sourcePage": "https://sanctsound.ioos.us/sounds.html",
      "catalogedAt": "2026-05-16T02:29:10.862Z"
    },
    {
      "filename": "SanctSound_SB01_01_atlanticcod_20181113T024154Z.mp4",
      "url": "https://sanctsound.ioos.us/files/SanctSound_SB01_01_atlanticcod_20181113T024154Z.mp4",
      "sanctuary": "Stellwagen Bank",
      "category": "fish",
      "label": "Atlantic cod grunts",
      "description": "Cod grunting during winter reproductive season east of Boston. This species once fed empires; now fewer than 2% of historic numbers remain.",
      "recordedAt": "2018-11-13T02:41:54Z",
      "site": "SB01",
      "deployment": "01",
      "groupKey": "SB01-01-atlanticcod-20181113T024154Z",
      "variant": "original",
      "sourceType": "video",
      "sourcePage": "https://sanctsound.ioos.us/sounds.html",
      "catalogedAt": "2026-05-16T02:29:10.862Z"
    },
    {
      "filename": "SanctSound_PM05_01_damselfish_20191001T040002Z.mp4",
      "url": "https://sanctsound.ioos.us/files/SanctSound_PM05_01_damselfish_20191001T040002Z.mp4",
      "sanctuary": "Papahānaumokuākea",
      "category": "fish",
      "label": "Damselfish",
      "description": "Damselfish produce sounds, such as chirps, during activities related to competition and reproduction. These sounds from a damselfish were recorded at Gardner Pinnacles in Papahānaumokuākea monument.",
      "recordedAt": "2019-10-01T04:00:02Z",
      "site": "PM05",
      "deployment": "01",
      "groupKey": "PM05-01-damselfish-20191001T040002Z",
      "variant": "original",
      "sourceType": "video",
      "sourcePage": "https://sanctsound.ioos.us/sounds.html",
      "catalogedAt": "2026-05-16T02:29:10.862Z"
    },
    {
      "filename": "SanctSound_FK02_01_fishchorus_20190416T004332Z.mp4",
      "url": "https://sanctsound.ioos.us/files/SanctSound_FK02_01_fishchorus_20190416T004332Z.mp4",
      "sanctuary": "Florida Keys",
      "category": "fish",
      "label": "Fish chorus (reef)",
      "description": "A loud underwater chorus of fish popping and calling during reproductive season south of Key West.",
      "recordedAt": "2019-04-16T00:43:32Z",
      "site": "FK02",
      "deployment": "01",
      "groupKey": "FK02-01-fishchorus-20190416T004332Z",
      "variant": "original",
      "sourceType": "video",
      "sourcePage": "https://sanctsound.ioos.us/sounds.html",
      "catalogedAt": "2026-05-16T02:29:10.862Z"
    },
    {
      "filename": "SanctSound_GR01_02_fishchorus_20190902T004059Z.mp4",
      "url": "https://sanctsound.ioos.us/files/SanctSound_GR01_02_fishchorus_20190902T004059Z.mp4",
      "sanctuary": "Gray's Reef",
      "category": "fish",
      "label": "Fish chorus",
      "description": "Various fish species chorusing during reproductive season off the Georgia coast — a deep, pulsing acoustic landscape.",
      "recordedAt": "2019-09-02T00:40:59Z",
      "site": "GR01",
      "deployment": "02",
      "groupKey": "GR01-02-fishchorus-20190902T004059Z",
      "variant": "original",
      "sourceType": "video",
      "sourcePage": "https://sanctsound.ioos.us/sounds.html",
      "catalogedAt": "2026-05-16T02:29:10.862Z"
    },
    {
      "filename": "SanctSound_HI06_01_fishchorus_20200615T031758Z.mp4",
      "url": "https://sanctsound.ioos.us/files/SanctSound_HI06_01_fishchorus_20200615T031758Z.mp4",
      "sanctuary": "Hawaiian Islands",
      "category": "fish",
      "label": "Fish chorus",
      "description": "Various fish species chorusing off the northwest coast of Hawaiʻi. Reproductive season fills the water with overlapping calls.",
      "recordedAt": "2020-06-15T03:17:58Z",
      "site": "HI06",
      "deployment": "01",
      "groupKey": "HI06-01-fishchorus-20200615T031758Z",
      "variant": "original",
      "sourceType": "video",
      "sourcePage": "https://sanctsound.ioos.us/sounds.html",
      "catalogedAt": "2026-05-16T02:29:10.862Z"
    },
    {
      "filename": "haddock.mp4",
      "url": "https://sanctsound.ioos.us/files/haddock.mp4",
      "sanctuary": "Stellwagen Bank",
      "category": "fish",
      "label": "Haddock knocks",
      "description": "Haddock knocking during reproductive season at Stellwagen Bank. The drumming sound comes from a muscle vibrating the swim bladder.",
      "recordedAt": null,
      "site": "SB01",
      "deployment": "01",
      "groupKey": "SB01-01-haddock",
      "variant": "original",
      "sourceType": "video",
      "sourcePage": "https://sanctsound.ioos.us/sounds.html",
      "catalogedAt": "2026-05-16T02:29:10.862Z"
    },
    {
      "filename": "SanctSound_CI01_02_plainfinmidshipman_20190426T085921Z.mp4",
      "url": "https://sanctsound.ioos.us/files/SanctSound_CI01_02_plainfinmidshipman_20190426T085921Z.mp4",
      "sanctuary": "Channel Islands",
      "category": "fish",
      "label": "Midshipman hum",
      "description": "Male plainfin midshipman humming for hours to attract females — a deep, vibrating drone from north of Santa Rosa Island.",
      "recordedAt": "2019-04-26T08:59:21Z",
      "site": "CI01",
      "deployment": "02",
      "groupKey": "CI01-02-plainfinmidshipman-20190426T085921Z",
      "variant": "original",
      "sourceType": "video",
      "sourcePage": "https://sanctsound.ioos.us/sounds.html",
      "catalogedAt": "2026-05-16T02:29:10.862Z"
    },
    {
      "filename": "SanctSound_MB02_05_plainfinmidshipman_20200606T041700Z.mp4",
      "url": "https://sanctsound.ioos.us/files/SanctSound_MB02_05_plainfinmidshipman_20200606T041700Z.mp4",
      "sanctuary": "Monterey Bay",
      "category": "fish",
      "label": "Midshipman hum (hours long)",
      "description": "Male midshipman humming to guard his nest at Point Pinos. These hums last hours and travel through wood — boat owners sometimes hear them at night.",
      "recordedAt": "2020-06-06T04:17:00Z",
      "site": "MB02",
      "deployment": "05",
      "groupKey": "MB02-05-plainfinmidshipman-20200606T041700Z",
      "variant": "original",
      "sourceType": "video",
      "sourcePage": "https://sanctsound.ioos.us/sounds.html",
      "catalogedAt": "2026-05-16T02:29:10.862Z"
    },
    {
      "filename": "SanctSound_FK03_01_redgrouper_20190201T054658Z.mp4",
      "url": "https://sanctsound.ioos.us/files/SanctSound_FK03_01_redgrouper_20190201T054658Z.mp4",
      "sanctuary": "Florida Keys",
      "category": "fish",
      "label": "Red grouper",